{ 
"object": "list", 
"url": "/v1/charges", 
"count": 2, 
"data": [ 
  { 
  "id": "ch_2W2skeSVoEIgH8", 
  "object": "charge", 
  "created": 1378379935, 
  "livemode": false, 
  "paid": true, 
  "amount": 400, 
  "currency": "usd", 
  "refunded": false, 
  "card": 
    {
     "id": "cc_1SvbSeGL19eaMi", 
     "object": "card", 
     "last4": "4242", 
     "type": "Visa", 
     "exp_month": 8, 
     "exp_year": 2014, 
     "fingerprint": "qhjxpr7DiCdFYTlH", 
     "customer": null, 
     "country": "US", 
     "name": null, 
     "address_line1": null, 
     "address_line2": null, 
     "address_city": null, 
     "address_state": null, 
     "address_zip": null, 
     "address_country": null, 
     "cvc_check": null, 
     "address_line1_check": null, 
     "address_zip_check": null }, 
   "captured": true, "refunds": [ 
     { 
     "amount": 400, 
     "currency": "usd", 
     "created": 1378379955, 
     "object": "refund", 
     "balance_transaction": "txn_2W2s5pXW1h3t3Q" } ],
   "balance_transaction": "txn_2VrwM1WyxXifsV", 
   "failure_message": null, 
   "failure_code": null, 
   "amount_refunded": 400, 
   "customer": null, 
   "invoice": null, 
   "description": "Charge for test@example.com", 
   "dispute": null }, 
  { 
  "id": "ch_2W2skeusdf67IgH8", 
  "object": "charge", 
  "created": 1378374535, 
  "livemode": false, 
  "paid": true, 
  "amount": 500, 
  "currency": "usd", 
  "refunded": false, 
  "card": 
    {
     "id": "cc_1SvbSeGL19eaMi", 
     "object": "card", 
     "last4": "4242", 
     "type": "Visa", 
     "exp_month": 8, 
     "exp_year": 2014, 
     "fingerprint": "qhjxpr7DiCdFYTlH", 
     "customer": null, 
     "country": "US", 
     "name": null, 
     "address_line1": null, 
     "address_line2": null, 
     "address_city": null, 
     "address_state": null, 
     "address_zip": null, 
     "address_country": null, 
     "cvc_check": null, 
     "address_line1_check": null, 
     "address_zip_check": null }, 
   "captured": true, "refunds": [ 
     { 
     "amount": 500, 
     "currency": "usd", 
     "created": 1378379955, 
     "object": "refund", 
     "balance_transaction": "txn_2W2s5pXsdfsd3t3Q" } ],
   "balance_transaction": "txn_2W2s5pXsdfsd3t3Q", 
   "failure_message": null, 
   "failure_code": null, 
   "amount_refunded": 500, 
   "customer": null, 
   "invoice": null, 
   "description": "Charge 2 for test@example.com", 
   "dispute": null }
 ] }